{
  "schema": "torchsynth-trace-registry",
  "schema_version": 1,
  "semantic_version": "voice-traces-v1",
  "schema_sha256": "ca95f8bd36f42cc619deb35775185946739aef9c6cfa4fa1ba00119fbb987525",
  "source_manifest_sha256": "565236e22ad8b1dcd620783024a114b0960e5534b1cb26e8dcf8dafc9c96c0af",
  "source_commit": "2b0964d4c6c3d472a2a0d54d91b408caaeffca6d",
  "requested_order": "trace-array-order",
  "alias_version": "probe-aliases-v1",
  "aliases": {
    "scalar-capture-v1": {
      "keyboard.midi_f0": {
        "target": "keyboard.midi_f0",
        "kind": "trace",
        "note": "Same boundary; existing producer evidence is unchanged."
      },
      "keyboard.duration": {
        "target": "keyboard.duration",
        "kind": "trace",
        "note": "Same boundary; existing producer evidence is unchanged."
      },
      "lfo_1_rate_adsr.output": {
        "target": "lfo_1_rate_adsr.output",
        "kind": "trace",
        "note": "Same boundary; existing producer evidence is unchanged."
      },
      "lfo_2_rate_adsr.output": {
        "target": "lfo_2_rate_adsr.output",
        "kind": "trace",
        "note": "Same boundary; existing producer evidence is unchanged."
      },
      "lfo_1_amp_adsr.output": {
        "target": "lfo_1_amp_adsr.output",
        "kind": "trace",
        "note": "Same boundary; existing producer evidence is unchanged."
      },
      "lfo_2_amp_adsr.output": {
        "target": "lfo_2_amp_adsr.output",
        "kind": "trace",
        "note": "Same boundary; existing producer evidence is unchanged."
      },
      "lfo_1.raw": {
        "target": "lfo_1.raw",
        "kind": "trace",
        "note": "Same boundary; existing producer evidence is unchanged."
      },
      "lfo_1.post_control_vca": {
        "target": "lfo_1.post_control_vca",
        "kind": "trace",
        "note": "Same boundary; existing producer evidence is unchanged."
      },
      "lfo_2.raw": {
        "target": "lfo_2.raw",
        "kind": "trace",
        "note": "Same boundary; existing producer evidence is unchanged."
      },
      "lfo_2.post_control_vca": {
        "target": "lfo_2.post_control_vca",
        "kind": "trace",
        "note": "Same boundary; existing producer evidence is unchanged."
      },
      "adsr_1.output": {
        "target": "adsr_1.output",
        "kind": "trace",
        "note": "Same boundary; existing producer evidence is unchanged."
      },
      "adsr_2.output": {
        "target": "adsr_2.output",
        "kind": "trace",
        "note": "Same boundary; existing producer evidence is unchanged."
      },
      "mod_matrix.vco_1_pitch": {
        "target": "mod_matrix.vco_1_pitch",
        "kind": "trace",
        "note": "Same boundary; existing producer evidence is unchanged."
      },
      "mod_matrix.vco_1_amp": {
        "target": "mod_matrix.vco_1_amp",
        "kind": "trace",
        "note": "Same boundary; existing producer evidence is unchanged."
      },
      "mod_matrix.vco_2_pitch": {
        "target": "mod_matrix.vco_2_pitch",
        "kind": "trace",
        "note": "Same boundary; existing producer evidence is unchanged."
      },
      "mod_matrix.vco_2_amp": {
        "target": "mod_matrix.vco_2_amp",
        "kind": "trace",
        "note": "Same boundary; existing producer evidence is unchanged."
      },
      "mod_matrix.noise_amp": {
        "target": "mod_matrix.noise_amp",
        "kind": "trace",
        "note": "Same boundary; existing producer evidence is unchanged."
      },
      "control_upsample.vco_1_pitch": {
        "target": "control_upsample.vco_1_pitch",
        "kind": "trace",
        "note": "Same boundary; existing producer evidence is unchanged."
      },
      "vco_1.raw": {
        "target": "vco_1.raw",
        "kind": "trace",
        "note": "Same boundary; existing producer evidence is unchanged."
      },
      "control_upsample.vco_1_amp": {
        "target": "control_upsample.vco_1_amp",
        "kind": "trace",
        "note": "Same boundary; existing producer evidence is unchanged."
      },
      "vco_1.post_vca": {
        "target": "vco_1.post_vca",
        "kind": "trace",
        "note": "Same boundary; existing producer evidence is unchanged."
      },
      "control_upsample.vco_2_pitch": {
        "target": "control_upsample.vco_2_pitch",
        "kind": "trace",
        "note": "Same boundary; existing producer evidence is unchanged."
      },
      "vco_2.raw": {
        "target": "vco_2.raw",
        "kind": "trace",
        "note": "Same boundary; existing producer evidence is unchanged."
      },
      "control_upsample.vco_2_amp": {
        "target": "control_upsample.vco_2_amp",
        "kind": "trace",
        "note": "Same boundary; existing producer evidence is unchanged."
      },
      "vco_2.post_vca": {
        "target": "vco_2.post_vca",
        "kind": "trace",
        "note": "Same boundary; existing producer evidence is unchanged."
      },
      "noise.raw": {
        "target": "noise.raw",
        "kind": "trace",
        "note": "Same boundary; existing producer evidence is unchanged."
      },
      "control_upsample.noise_amp": {
        "target": "control_upsample.noise_amp",
        "kind": "trace",
        "note": "Same boundary; existing producer evidence is unchanged."
      },
      "noise.post_vca": {
        "target": "noise.post_vca",
        "kind": "trace",
        "note": "Same boundary; existing producer evidence is unchanged."
      },
      "mixer.pre_normalization": {
        "target": "mixer.pre_normalization",
        "kind": "trace",
        "note": "Same boundary; existing producer evidence is unchanged."
      },
      "mixer.peak": {
        "target": "mixer.peak",
        "kind": "trace",
        "note": "Same boundary; existing producer evidence is unchanged."
      },
      "mixer.gain": {
        "target": "mixer.gain",
        "kind": "trace",
        "note": "Same boundary; existing producer evidence is unchanged."
      },
      "mixer.output": {
        "target": "mixer.output",
        "kind": "trace",
        "note": "Same boundary; existing producer evidence is unchanged."
      },
      "input.normalized": {
        "target": "input.normalized",
        "kind": "input-checkpoint",
        "note": "Name-keyed normalized parameter bytes, before physical conversion and DSP."
      },
      "input.noise": {
        "target": "input.noise",
        "kind": "input-checkpoint",
        "note": "Resolved selected stream; noise.raw is its later graph observation."
      },
      "physical.parameters": {
        "target": "physical.parameters",
        "kind": "input-checkpoint",
        "note": "Actual name-keyed runtime conversion, not analytic fixture values."
      },
      "audio.final": {
        "target": "mixer.output",
        "kind": "trace",
        "note": "Voice return aliases original mixer output; no additional DSP."
      }
    },
    "repeatability-v1": {
      "adsr_1": {
        "target": "adsr_1.output",
        "kind": "trace",
        "note": "Same boundary; existing producer evidence is unchanged."
      },
      "adsr_2": {
        "target": "adsr_2.output",
        "kind": "trace",
        "note": "Same boundary; existing producer evidence is unchanged."
      },
      "lfo_1": {
        "target": "lfo_1.raw",
        "kind": "trace",
        "note": "Same boundary; existing producer evidence is unchanged."
      },
      "lfo_2": {
        "target": "lfo_2.raw",
        "kind": "trace",
        "note": "Same boundary; existing producer evidence is unchanged."
      },
      "vco_1": {
        "target": "vco_1.raw",
        "kind": "trace",
        "note": "Same boundary; existing producer evidence is unchanged."
      },
      "vco_2": {
        "target": "vco_2.raw",
        "kind": "trace",
        "note": "Same boundary; existing producer evidence is unchanged."
      },
      "noise": {
        "target": "noise.raw",
        "kind": "trace",
        "note": "Same boundary; existing producer evidence is unchanged."
      },
      "pre_normalization": {
        "target": "mixer.pre_normalization",
        "kind": "trace",
        "note": "Same boundary; existing producer evidence is unchanged."
      },
      "audio": {
        "target": "mixer.output",
        "kind": "trace",
        "note": "Same boundary; existing producer evidence is unchanged."
      },
      "normalized": {
        "target": "input.normalized",
        "kind": "input-checkpoint",
        "note": "Name-keyed normalized parameter bytes, before physical conversion and DSP."
      },
      "physical": {
        "target": "physical.parameters",
        "kind": "input-checkpoint",
        "note": "Actual name-keyed runtime conversion, not analytic fixture values."
      }
    }
  },
  "traces": [
    {
      "name": "keyboard.midi_f0",
      "producer": {
        "module": "keyboard",
        "occurrence": 1,
        "output_index": 0,
        "mechanism": "forward-hook"
      },
      "consumers": [
        "vco_1#1.arg0",
        "vco_2#1.arg0"
      ],
      "meaning": "Physical keyboard base pitch before VCO tuning, depth and MIDI clamp.",
      "unit": "MIDI-semitones",
      "range": {
        "minimum": 0,
        "maximum": 127,
        "basis": "source-parameter",
        "note": "Analytical bound for valid finite default-nebula inputs; not a measured coverage or rounding tolerance."
      },
      "kind": "scalar",
      "rate_hz": null,
      "sample_count": null,
      "shape": [],
      "batch_shape": [
        "B"
      ],
      "dtype": "float32",
      "encoding": "f32le",
      "observation": "observed",
      "boundary": "physical-keyboard-output",
      "time": null,
      "interpolation": null
    },
    {
      "name": "keyboard.duration",
      "producer": {
        "module": "keyboard",
        "occurrence": 1,
        "output_index": 1,
        "mechanism": "forward-hook"
      },
      "consumers": [
        "lfo_1_rate_adsr#1.arg0",